{
  "ver": "1.3.0",
  "nam": {
    "fn": "ابو بكر محمد بن زكريا الرازي",
    "fnt": "ABU<BAKR<MOHAMMED<IBN<ZAKARIA<AL<RAZI",
    "gn": "ناصر",
    "gnt": "NASR"
  },
  "dob": "1964",
  "v": [
    {
      "tg": "840539006",
      "vp": "1119349007",
      "mp": "EU/1/20/1507",
      "ma": "ORG-100031184",
      "dn": 1,
      "sd": 2,
      "dt": "2021-06-11",
      "co": "NL",
      "is": "Ministry of Health Welfare and Sport",
      "ci": "urn:uvci:01:NL:dadfcc47c7334e45a906db12fd859fb7"
    }
  ]
}
