{
  "ver": "1.0.0",
  "nam": {
    "fn": "d'Arsøns - van Halen",
    "gn": "François-Joan",
    "fnt": "DARSONS<VAN<HALEN",
    "gnt": "FRANCOIS<JOAN"
  },
  "dob": "2009-02-28",
  "t": [
    {
      "tg": "840539006",
      "tt": "LP6464-4",
      "nm": "Roche LightCycler qPCR",
      "tr": "260415000",
      "sc": "2021-04-13T14:20:00+00:00",
      "tc": "GGD Fryslân, L-Heliconweg",
      "co": "NL",
      "is": "Ministry of Public Health, Welfare and Sport",
      "ci": "urn:uvci:01:NL:GGD/81AAH16AZ"
    }
  ]
}
