{
  "ver": "1.3.0",
  "nam": {
    "fn": "ابو بكر محمد بن زكريا الرازي",
    "fnt": "ABU<BAKR<MOHAMMED<IBN<ZAKARIA<AL<RAZI",
    "gn": "ناصر",
    "gnt": "NASR"
  },
  "dob": "1964",
  "t": [
    {
      "tg": "840539006",
      "tt": "LP6464-4",
      "nm": "ELITechGroup, SARS-CoV-2 ELITe MGB® Kit",
      "sc": "2021-06-11T17:30:00Z",
      "tr": "260415000",
      "tc": "Example Test Corp, Big City",
      "co": "NL",
      "is": "Ministry of Health Welfare and Sport",
      "ci": "urn:uvci:01:NL:dadfcc47c7334e45a906db12fd859fb2"
    }
  ]
}
