{
  "ver": "1.3.0",
  "nam": {
    "fn": "Smith-Jones",
    "fnt": "SMITH<JONES",
    "gn": "Charles Edward",
    "gnt": "CHARLES<EDWARD"
  },
  "dob": "1964",
  "v": [
    {
      "tg": "840539006",
      "vp": "1119349007",
      "mp": "EU/1/20/1507",
      "ma": "ORG-100031184",
      "dn": 1,
      "sd": 2,
      "dt": "2021-06-11",
      "co": "UNHCR",
      "is": "United Nations HCR",
      "ci": "URN/UVCI/01/NL/DADFCC47C7334E45A906DB12FD859FB7"
    }
  ]
}
